,class_sms,sms
4896,spam,Want the latest Video handset?  anytime any network mins? Half price line rental? Reply call  for delivery tomorrow
4901,spam, are guaranteed the latest Nokia Phone iPod player £ prize! Txt word: COLLECT: ! IBHltd LdnWH/Mtmsgrcvd
4903,spam,* FREE* POLYPHONIC RINGTONE Text SUPER get your FREE POLY TONE the week now PoBox subscription
4906,spam,Warner Village Colin Farrell SWAT this wkend @Warner Village & get  free med. Popcorn!Just show msg+ticket@kiosk.Valid @kiosk. Reply SONY  mre film offers
4914,spam,Goal! Arsenal  (Henry Liverpool  Henry scores with simple shot from  yards from pass Bergkamp give Arsenal  goal margin after  mins.
4918,spam,"This the time have tried  contact have won the  Pound prize.  claim easy, call  NOW! Only per min-national-rate"
4930,spam,"Got what takes  take part the WRC Rally can with Lucozade Energy! Text RALLY), see packs lucozade/wrc & itcould!"
4931,spam,", the SEXYCHAT girls are waiting for you text them. Text now for great night chatting. send STOP stop this service"
4948,spam,Great News! Call FREEFONE claim your guaranteed £ CASH £ gift. Speak live operator NOW!
4949,spam," this Amy will sending you free phone number couple days, which will give you access all the adult parties..."
4953,spam,Welcome Select service with added benefits. You can now call our specially trained advisors FREE from your mobile dialling .
4965,spam,Dear Voucher holder Have your next meal. Use the following link your  enjoy    dining experiencehttp://www.vouchme.com/etlp/dining.asp
4967,spam,URGENT are trying contact. Todays draw shows that you have won £ prize GUARANTEED. Call  from land line. Claim . Valid hrs only
4968,spam,You can donate UNICEF Asian Tsunami disaster support fund texting DONATE . £. will added your next bill
4985,spam,goldviking inviting you his friend. Reply YES- See him: www.SMS/goldviking STOP? Send STOP FRND 
4991,spam,Phony £ award - Todays Voda numbers ending XXXX are selected receive £ award you have match please call  quoting claim code  standard rates app
5004,spam,CDs: Congratulations awarded gift vouchers £ gift guaranteed & Freeentry  £ wkly draw MUSIC  TnCs www.ldew.comwinppmxage 
5012,spam,You have WON guaranteed £ cash £ prize claim prize call our customer service representative  between Cost
5018,spam,Dear xxxxxxx been invited XCHAT. This our final attempt contact! Txt CHAT/MsgrcvdHG/Suite/Lands/Row/WJHL LDN yrs
5027,spam, cash-balance currently  pounds maximize cash now send  only/meg/Suite/lands Row/WjHL
5028,spam,PRIVATE! Your  Account Statement for shows-redeemed. points. Call  Identifier Code Expires //
5030,spam, like tell you deepest darkest fantasies. Call  just/min stop texts call  (nat rate)
5037,spam,You won believe but true Incredible Txts! Reply now learn truly amazing things that will blow your mind. From OFWD only/txt
5041,spam,Natalie inviting you her friend. Reply YES- See her: www.SMS/nataliek STOP? Send STOP FRND 
5043,spam,Jamster get your free wallpaper text HEART  now apply.  only. Need Help? Call .
5055,spam,Double Mins & Double Txt & / price Linerental Latest Orange Bluetooth mobiles. Call MobileUpd for the very latest offers calloptout
5060,spam,Free video camera phones with Half Price line rental for  mths and  cross ntwk mins  txts. Call MobileUpd CallOptOut/
5068,spam, Break AccommodationVouchers terms & conditions apply.  claim you mustprovide your claim number which  
5071,spam,  alfie Moon Children need song mob. Tell. Txt Tone charity  for Nokias Poly charity for polys: zed  profit  charity.
5073,spam,WIN £ Shopping spree every WEEK Starting NOW.  play text STORE . SkilGme. TsCs Winawk! age £.perweeksub.
5076,spam,"This the attempt contract, you have won this weeks top prize either £ cash £ prize. Just call "
5079,spam, you want New Nokia colour phone DeliveredTomorrow? With  free minutes any mobile +  free texts + Free Camcorder reply call .
5098,spam,"TheMob>Hit the link get premium Pink Panther game, the new.  from Sugababes crazy Zebra animation badass Hoody wallpaper-all  FREE!"
5102,spam,This msg for your mobile content order has been resent previous attempt failed due network error Queries customersqueries@netvision.com
5110,spam,You have  new message. Please call 
5112,spam,December only! Had your mobile mths+? You are entitled update the latest colour camera mobile for Free! Call The Mobile Update VCo FREE  
5115,spam,"Get  Lions England tone, reply lionm  mono lionp  poly.  more  www.ringtones, the original best. Tones GBP network operator rates apply."
5120,spam,PRIVATE! Your  Account Statement for 
5137,spam,"YOU WON! Your * Costa Del Sol Holiday £ await collection. Call  Now toClaim. SAE, POBox, Stockport, SKxh, Cost, Maxmins"
5141,spam,FREE for week Nokia tone mobile every week just txt NOKIA  Get txting and tell mates. www.getzed POBox  WWQ + normp/tone
5147,spam,Get your garden ready for summer with FREE selection summer bulbs and seeds worth £: only with The Scotsman this Saturday stop notxt
5164,spam,"Congrats  mobile Videophones yours. call  now! videochat wid mates, play java games, Dload polypH music, noline rentl"
5178,spam,SMS AUCTION BRAND NEW Nokia  auction today! Auction FREE  join & take part! Txt NOKIA  now!
5189,spam,ree entry weekly comp for chance win ipod. Txt POD get entry (std txt rate apply  for details +
5190,spam,Our records indicate maybe entitled  pounds compensation for the Accident you had claim  free reply with CLAIM this msg.  stop txt STOP
5196,spam,"Spook your mob with Halloween collection logo & pic message plus free eerie tone, txt CARD SPOOK  zed per logo/pic "
5200,spam,Call Germany for only  pence per minute! Call from fixed line via access number prepayment. Direct access! www.telediscount
5201,spam,"YOU WON! Your * Costa Del Sol Holiday £ await collection. Call  Now toClaim. SAE, POBox, Stockport, SKxh, Cost, Maxmins"
5205,spam,Had your mobile mths ? Update for FREE Oranges latest colour camera mobiles & unlimited weekend calls. Call Mobile Upd freefone StopTxt
5214,spam,Natalja inviting you her friend. Reply YES- See her: www.SMS/nat STOP? Send STOP FRND 
5228,spam,PRIVATE! Your  Account Statement for <fone> shows-redeemed. points. Call  Identifier Code:  Expires //
5232,spam,YOU ARE CHOSEN RECEIVE £ AWARD! Pls call claim number collect your award which you are selected receive valued mobile customer.
5237,spam,Someonone you know trying contact you via our dating service find out who could call from your mobile landline  BOXSKch 
5250,spam,Urgent! Please call  from landline. £ cash * holiday await collection SAE Box  MXY. +
5269,spam," you don, your prize will another customer www.biz/min Polo Ltd Suite  London Please call back busy "
5278,spam,URGENT! Your Mobile number has been awarded with £ prize GUARANTEED. Call  from land line. Claim . Valid hrs only ppm
5285,spam,"URGENT! You have won  week FREE membership our £, Prize Jackpot! Txt the word: CLAIM www.dbuk.net LCCLTD POBOX LDNWARW"
5292,spam,Urgent! Please call  from landline. £ cash luxury * Canary Islands Holiday await collection SAE Box . MXY. ppm. +
5294,spam,XMAS iscoming awarded either gift vouchers & free entry £ weekly draw txt MUSIC  TnC www.Ldew.comwinppmxagesubscription 
5314,spam,Get the official ENGLAND poly ringtone colour flag yer mobile for tonights game! Text TONE FLAG . Optout txt ENG STOP Box WWX £.
5342,spam," subscribed  TEXTCOMP  wkly comp free question follows, subsequent wks charged/msg. unsubscribe txt STOP  ,custcare "
5364,spam,Call  and send our girls into erotic ecstacy. Just/min stop texts call  (nat rate)
5365,spam,Camera - You are awarded SiPix Digital Camera! call  fromm landline. Delivery within  days.
5366,spam, £ XMAS REWARD WAITING FOR YOU! Our computer has randomly picked you from our loyal mobile customers receive £ reward. Just call 
5368,spam,IMPORTANT MESSAGE. This final contact attempt. You have important messages waiting out our customer claims dept. Expires //. Call  NOW!
5370,spam,dating have had two these. Only started after sent text talk sport radio last week. Any connection you think coincidence?
5377,spam,The current leading bid pause this auction send OUT. Customer Care: 
5378,spam,"Free entry the grprizes wkly comp chance win the latest Nokia , PSP £ cash every.TXT GREAT  http//www.grprizes.com "
5381,spam,You have  new message. Call --
5427,spam,Santa Calling! Would your little ones like call from Santa Xmas eve? Call book your time.
5443,spam,You have won guaranteed  award maybe even £ cash claim award call free  ..... (+). Its legitimat efreefone number wat think???
5449,spam,"Latest News! Police station toilet stolen, cops have nothing!"
5456,spam,For the most sparkling shopping breaks from  per person; call visit www.shortbreaks.org
5460,spam,December only! Had your mobile mths+? You are entitled update the latest colour camera mobile for Free! Call The Mobile Update FREE 
5462,spam,Txt: CALL:  & claim your reward  hours talk time use from your phone now! SubscribeGBP/mnth inc hrs  stop?txtStop www.gamb
5466,spam,http//tms. widelive.com/index. wml=ada&first=true Ringtone¡
5467,spam,Get your garden ready for summer with FREE selection summer bulbs and seeds worth £: only with The Scotsman this Saturday stop notxt
5468,spam,URGENT! Last weekend draw shows that you have won £ cash Spanish holiday! CALL NOW claim: RSTM. ppm
5482,spam,URGENT are trying contact you Last weekends draw shows have won £ prize GUARANTEED Call  Claim code Valid hrs
5487,spam, per min call Germany  from your line. Just per min. Check PlanetTalkInstant.com for info. Text stop opt out
5492,spam,Marvel Mobile Play the official Ultimate Spider-man game mobile right now. Text SPIDER  for the game send FREE Ball wallpaper
5497,spam,"SMS SERVICES. for your inclusive text credits, pls goto www.comuk.net login= qxj unsubscribe with STOP extra charge. help .COMUK"
5501,spam,PRIVATE! Your  Account Statement for  shows-redeemed. points. Call  Identifier Code:  Expires //
5524,spam,You are awarded SiPix Digital Camera! call  from landline. Delivery within days Box. MBP warranty. ppm£.
5526,spam,PRIVATE! Your  Account Statement for shows-redeemed. points. Call  Identifier Code:  Expires //
5537,spam,Want explicit SEX  secs? Ring  now! Costs/min Gsex POBOX  WCN
5540,spam,ASKED MOBILE  CHATLINES INCLU FREE MINS. INDIA CUST SERVs SED YES. LER GOT MEGA BILL.  DONT GIV SHIT. BAILIFF DUE DAYS £  WANT £
5547,spam,"Had your contract mobile  Mnths? Latest Motorola, Nokia etc. all FREE! Double Mins & Text Orange tariffs. TEXT YES for callback remove from records."
5566,spam,"REMINDER FROM get . pounds free call credit and details great offers pls reply  this text with your valid name, house and postcode"
5567,spam,"This the time have tried  contact have won the £ Pound prize.  claim easy, call  NOW! Only per minute-national-rate."
