,class_sms,sms
3272,spam,You have  new voicemail. Please call .
3289,spam,"Someone know has asked our dating service  contact you! Cant Guess who? CALL  NOW all will revealed. POBox , LSHB "
3290,spam,Camera - You are awarded SiPix Digital Camera! call  fromm landline. Delivery within  days
3298,spam,Todays Voda numbers ending  are selected receive ? award you hava match please call  quoting claim code  standard rates app 
3299,spam,This message free. Welcome the new & improved Sex & Dogging club unsubscribe from this service reply STOP. msgs  only
3302,spam,RCT' THNQ Adrian for text. Rgds Vatian
3316,spam,"FREE MESSAGE Activate your  FREE Text Messages replying this message with the word FREE For terms & conditions, visit www..com"
3334,spam,"You are being contacted our dating service someone you know find out who, call from land line . PoBoxWTGP"
3360,spam,Sorry missed your call let talk when you have the time 
3382,spam,"complimentary  STAR Ibiza Holiday £, cash needs your URGENT collection.  NOW from Landline not lose out! BoxSKWPPPM+"
3385,spam,FREE MSG billed your mobile number mistake from shortcode .Please call have charges refunded.This call will free from landline
3391,spam,Please CALL  immediately there urgent message waiting for you
3397,spam,URGENT! Your Mobile number has been awarded with £ Bonus Caller Prize. Call  from land line. Valid hrs only
3401,spam," valued customer pleased advise you that following recent review your Mob. you are awarded with £ Bonus Prize, call "
3409,spam, you want New Nokia colour phone DeliveredTomorrow? With  free minutes any mobile +  free texts + Free Camcorder reply call 
3419,spam,LIFE has never been this much fun and great until you came. You made truly special for won forget you! enjoy @ one gbp/sms
3420,spam, you want new Video phone?  anytime any network mins  Inclusive Video calls AND downloads  per week Free delTOMORROW call reply NOW
3421,spam," valued customer pleased advise you that following recent review your Mob. you are awarded with £ Bonus Prize, call "
3422,spam,Welcome! Please reply with your AGE and GENDER begin
3423,spam,Freemsg: -month unlimited free calls! Activate SmartCall Txt: CALL: . Subscriptngbp unlimited calls Help:  Stop?txt stop landlineonly
3424,spam,Had your mobile  mths? Update latest Orange camera/video phones for FREE. Save with Free texts/weekend calls. Text YES for callback orno opt out
3425,spam, new  club & dont fink met yet Will Please leave msg day wiv area  reply promised CARLIE Calls£/minMobsmore LKPOBOXHPFL
3433,spam,Camera - You are awarded SiPix Digital Camera! call  fromm landline. Delivery within  days.
3442,spam,Get FREE mobile video player FREE movie collect text . Its free! Extra films can ordered and apply.  yrs only
3443,spam,Save money wedding lingerie www.bridal.petticoatdreams Choose from superb selection with national delivery. Brought you WeddingFriend
3460,spam,Not heard from while. Call now here all night with just knickers. Make beg for like did last time Luv Nikiyu.net
3463,spam,Bloomberg -Message center + Why wait? Apply for your future http://careers. bloomberg.com
3468,spam,URGENT are trying contact. Todays draw shows that you have won £ prize GUARANTEED. Call  from land line. Claim. Validhrs only
3483,spam, you want NEW video phone anytime any network mins  text for only five pounds per week call  now reply for delivery tomorrow
3495,spam,"You are being contacted our dating service someone you know find out who, call from land line . PoBoxWTGP"
3496,spam,"Wan win Meet+Greet with Westlife? They are currently what tour? )Unbreakable, )Untamed, )Unkempt. Text . Cost +std text"
3501,spam,Dorothy@kiefer.com (Bank Granite issues Strong-Buy) EXPLOSIVE PICK FOR OUR MEMBERS OVER % *********** Nasdaq Symbol CDGT That $. per..
3529,spam,"You are £ winner Guaranteed Caller Prize, this our Final attempt contact you Claim Call  Now! ppmPOBoxBhamBXE"
3530,spam,"Xmas & New Years Eve tickets are now sale from the club, during the day from till, and Thurs, Fri & Sat night this week. They selling fast!"
3548,spam,Rock chik. Get filthy films &XXX pics phone now. rply FILTH . Saristar Ltd per  days. Stop cancel
3556,spam,From next month get upto % More Calls standard network charge  activate Call Wire.net stTerms PoBox Cost £. min MobcudB more
3560,spam,URGENT are trying contact Todays draw shows that you have won £ prize GUARANTEED. Call  from land line. Claim boxcpm
3562,spam,Text BANNEDUK see! cost textoperator gga + XXX
3564,spam,"Auction round . The highest bid now £. Next maximum bid bid, send BIDS bid . Good luck."
3568,spam,Collect your VALENTINE weekend PARIS inc Flight & Hotel + £ Prize guaranteed! Text: PARIS: . www.rtf.sphosting.com
3571,spam,Customer Loyalty Offer:The NEW Nokia Mobile from ONLY TXTAUCTION! Txt word: START:  & get yours Now&Ctxt/MTmsg
3574,spam,You won believe but true Incredible Txts! Reply now learn truly amazing things that will blow your mind. From OFWD only/txt
3585,spam,  IBH Customer Loyalty Offer: The NEW NOKIA Mobile from ONLY TXTAUCTION!Txt word:START: & get Yours Now&
3587,spam, hot horny and willing live local you - text reply hear strt back from per msg Netcollex LtdHelpDesk:  reply Stop end
3595,spam, you want New Nokia Colour Phone Delivered Tomorrow? With  FREE minutes any mobile +  FREE text + FREE camcorder Reply Call 
3598,spam,Congratulations YOU Won. You Winner our August £ Prize Draw. Call  NOW. Prize Code .
3620,spam,  Alfie Moon Children Need song mob. Tell. Txt TONE CHARITY  for nokias POLY CHARITY for polys :zed  profit  charity 
3631,spam,Get the official ENGLAND poly ringtone colour flag yer mobile for tonights game! Text TONE FLAG . Optout txt ENG STOP Box WWX £.
3639,spam,"Customer service announcement recently tried make delivery you but were unable, please call-schedule. Ref:"
3642,spam,"You can stop further club tones replying ""STOP MIX"" See-tone.com/enjoy. html for terms. Club tones cost GBP./week. MFL Box (/)"
3646,spam,wamma get laid?want real doggin locations sent direct your mobile? join the UKs largest dogging network. txt dogs  now!nyt. eca £./msg.
3675,spam,You have won Nokia. This what you get when you win our FREE auction take part send Nokia  now/Suite/Lands Row/WJHL +
3679,spam,Promotion Number awarded City Break and could WIN £ Summer Shopping spree every. Txt STORE  . SkilGme. TsCsWinawk!Age £.perWKsub
3698,spam,You are winner you have been specially selected receive £ cash £ award. Speak live operator claim call. Cost
3709,spam,Free Top ringtone -sub weekly ringtone-get week free-send SUBPOLY -? per week-stop sms-
3720,spam,"Thanks for your ringtone order, reference number. Your mobile will charged .. Should your tone not arrive please call customer services . From: [colour=red]text[/colour]TXTstar"
3725,spam," there, nights lucky night! Uve been invited  XCHAT, the Uks wildest chat! Txt CHAT  now/MsgrcvdHG/Suite/Lands/Row/WJHL LDN yrs"
3742,spam,/ tfp
3750,spam,Dear Voucher Holder  claim your class airport lounge passes when using Your holiday voucher call . When booking quote class 
3755,spam,Bloomberg -Message center + Why wait? Apply for your future http://careers. bloomberg.com
3758,spam,YES! The only place town meet exciting adult singles now the. Txt CHAT  now/Msg.
3763,spam,FREE for week Nokia tone mob every week just txt NOKIA  Get txting and tell mates www.getzed POBox  WWQ normp/tone +
3766,spam,"Someone know has asked our dating service  contact you! Cant guess who? CALL  NOW all will revealed. POBox , SXY "
3778,spam,"Mila, age, blonde, new look sex with guys like fun with. Text MTALK/txt free. £. increments. Help"
3780,spam,"Claim  shopping spree, just call  now! Have you won! MobStoreQuizppm"
3789,spam,"Want funk fone with weekly new tone reply TONESU  this text. www.ringtones, the original best. Tones GBP network operator rates apply"
3792,spam,"Twinks, bears, scallies, skins and jocks are calling now. Don miss the weekend fun. Call/min.  stop texts call (nat rate)"
3801,spam, tried contact you your reply our offer Video Handset?  anytime any networks mins? UNLIMITED TEXT? Camcorder? Reply call  NOW
3807,spam,URGENT are trying contact you. Last weekends draw shows that you have won £ prize GUARANTEED. Call . Claim code. Valid hours only
3819,spam, XMAS iscoming awarded either gift vouchers & free entry £ weekly draw txt MUSIC  TnC
3828,spam,Congratulations can claim  VIP row Tickets Blu concert November Blu gift guaranteed Call claim www.smsco.net cost£.max 
3848,spam,Fantasy Football back your Sky Gamestar Sky Active and play Dream Team. Scoring starts Saturday register now!SKY OPT OUT 
3856,spam,Free msg: Single? Find partner your area real people are waiting chat now!Send CHAT Cncl send STOPCS £. per msg
3860,spam,"Win the newest Harry Potter and the Order the Phoenix (Book ) reply HARRY, answer  questions - chance the first among readers!"
3862,spam,Free Msg: Ringtone!From: http://tms. widelive.com/index. wml=baecefff*&first=true:-JUL-
3864,spam," god found your number again glad, text back xafter this msgs cst std ntwk chg £."
3885,spam, link your picture has been sent. You can also use http://alto/wave/wave.asp=
3891,spam,"Double Mins &  txts Orange tariffs. Latest Motorola, SonyEricsson & Nokia with Bluetooth FREE! Call MobileUpd calloptout"
3893,spam,URGENT This our attempt contact. Your £ prize from YESTERDAY still awaiting collection claim CALL NOW . ACLPM
3895,spam,Dear Dave this your final notice collect your * Tenerife Holiday # CASH award! Call  from landline. TCs SAE Box CWWX ppm
3897,spam,tells  call claim £ prize have  enter all mobile & personal details @ the prompts. Careful!
3905,spam,Your  account for XXXXXXXXX shows  unredeemed points claim call  Identifier code: XXXXX Expires ..
3906,spam, you want new video handset?  anytime any network mins? Half Price Line Rental? Camcorder? Reply call  for delivery tomorrow
3913,spam,You have important customer service announcement. Call FREEPHONE    now!
3921,spam,FREE>Ringtone! Reply REAL POLY REAL . PushButton . DontCha . BabyGoodbye . GoldDigger . WeBeBurnin tone FREE and  more when join for
3942,spam,"Free Msg: get Gnarls Barkleys ""Crazy"" ringtone TOTALLY FREE just reply this message right now!"
3954,spam,Refused loan? Secured Unsecured? Can get credit? Call free now text back 'help will!
3963,spam,"You have been specially selected receive "" award! Call  BEFORE the lines close. Cost ppm apply Promo"
3968,spam,YOU HAVE WON valued Vodafone customer our computer has picked YOU win £ prize collect easy. Just call 
3972,spam,Free video camera phones with Half Price line rental for  mths and  cross ntwk mins  txts. Call MobileUpd CallOptOut/&
3978,spam,Great NEW Offer - DOUBLE Mins & DOUBLE Txt best Orange tariffs AND get latest camera phones  FREE! Call MobileUpd free  NOW stoptxt
3981,spam,ringtoneking 
3988,spam,Ringtone Club new polys direct your mobile every week !
3991,spam,(Bank Granite issues Strong-Buy) EXPLOSIVE PICK FOR OUR MEMBERS OVER % *********** Nasdaq Symbol CDGT That $. per..
3998,spam,Bored housewives! Chat date now-national rate/min only from landlines!
3999,spam, tried call you your reply our sms for video mobile  mins UNLIMITED TEXT free camcorder Reply call now  Del Thurs
4001,spam,"This the time have tried contact have won the £ prize.  claim easy, just call  NOW! Only per minute-national-rate"
4011,spam,"Wan win Meet+Greet with Westlife? They are currently what tour? )Unbreakable, )Untamed, )Unkempt. Text . Cost +std text"
4012,spam,Please call our customer service representative FREEPHONE    between you have WON guaranteed £ cash £ prize!
4016,spam,You will receiving this week Triple Echo ringtone shortly. Enjoy!
4020,spam," been selected stay  top British hotels - FOR NOTHING! Holiday valued £! Dial claim - National Rate Call, SWSS"
4036,spam,YOU ARE CHOSEN RECEIVE £ AWARD! Pls call claim number collect your award which you are selected receive valued mobile customer.
4042,spam,Please call our customer service representative FREEPHONE    between you have WON guaranteed £ cash £ prize!
4047,spam,Win £ cash prize prize worth £
4048,spam,"Thanks for your ringtone order, reference number.Your mobile will charged .. Should your tone not arrive please call customer services "
4060,spam,Moby Pub Quiz.Win £ High Street prize know who the new Duchess Cornwall will? Txt her first name .unsub STOP
4061,spam,"This weeks SavaMob member offers are now accessible. Just call  for details! SavaMob, POBOX. Only £./week. SavaMob - offers mobile!"
4068,spam,"You are being contacted our Dating Service someone you know find out who, call from your mobile landline  PoBoxLDNS "
4069,spam,TBS/PERSOLVO. been chasing since Sept for£ definitely not paying now thanks your information will ignore them. Kath. Manchester.
4073,spam,Loans for any purpose even you have Bad Credit! Tenants Welcome. Call NoWorriesLoans.com 
4077,spam,: Kick off new season with wks FREE goals & news mobile! Txt club name VILLA 
4086,spam,"Orange brings you ringtones from all time Chart Heroes, with free hit each week Ringtones & Pics wap stop receiving these tips reply STOP."
4088,spam,PRIVATE! Your  Account Statement for  shows-redeemed. points. Call  Identifier Code:  Expires //
4091,spam, tried call you your reply our sms for video mobile  mins UNLIMITED TEXT + free camcorder Reply call  Now
4102,spam,GSOH? Good with SPAM the ladies could male gigolo?  join the fastest growing mens club reply ONCALL. mjzgroup. .stop reply STOP. msg@£.rcvd
4104,spam, have secret admirer who looking  make contact with-find out who they*reveal who thinks special-call 
4108,spam,HOT LIVE FANTASIES call now  Just per min NTT Ltd Box  Croydon national rate call
4112,spam,URGENT! Your Mobile number has been awarded <UKP> prize GUARANTEED. Call  from landline. Claim . Valid hrs only ppm
4127,spam,"SPJanuary Male Sale! Hot Gay chat now cheaper, call . National rate from/min cheap/min peak stop texts call/min)"
4134,spam,FreeMsg Today the day you are ready horny & live your town love sex fun & games! Netcollex Ltd per msg reply Stop end
4144,spam, The Simpsons Movie released July  name the band that died the start the film-Green Day-Blue Day-Red Day. (Send)
4149,spam,Please call Amanda with regard renewing upgrading your current-Mobile handset free charge. Offer ends today. Tel    subject and
4154,spam,"URGENT!! Your * Costa Del Sol Holiday £ await collection. Call  Now toClaim. SAE, POBox, Stockport, SKxh, Cost, Maxmins"
4156,spam,Want new Video Phone?  anytime any network mins? Half price line rental free text for  months? Reply call  for free delivery
4162,spam,Had your mobile  months more entitled Update the latest colour mobiles with camera for Free! Call The Mobile Update FREE 
4166,spam,Dear Voucher Holder claim this weeks offer your please http://www.wtlp/text apply.
4169,spam,Congrats! Nokia  video camera phone your Call  Calls cost ppm Ave call mins vary from mobiles + Close  post BCM Ldn WCNXX
4183,spam,"Urgent! Please call . Your ABTA complimentary * Spanish Holiday £, cash await collection SAE BOX ppm +"
4196,spam,"Double mins and txts  months FREE Bluetooth Orange. Available Sony, Nokia Motorola phones. Call MobileUpd calloptout/NDX"
4198,spam,FREE for week Nokia tone mob every week just txt NOKIA  Get txting and tell mates www.getzed POBox  WWQ normp/tone +
4199,spam,"Want funk fone with weekly new tone reply TONESU  this text. www.ringtones, the original best. Tones GBP network operator rates apply"
4200,spam,"cmon babe, make horny, *turn! Txt your fantasy now babe hot, sticky and need you now. All replies cost £..  cancel send STOP"
4206,spam,IMPORTANT INFORMATION  ORANGE USER XXXXXX. TODAY LUCKY DAY! FIND OUT WHY LOG ONTO http://www.urawinner.com THERE FANTASTIC PRIZEAWAITING YOU!
4213,spam,Missed call alert. These numbers called but left message. 
4236,spam,FREEMSG: Our records indicate you may entitled  pounds for the Accident you had claim for free reply with YES this msg opt out text STOP
4237,spam," can WIN Music Gift Vouchers every week starting NOW Txt the word DRAW  TsCs www.Idew.com SkillGame, Winaweek, age. ppermessSubscription"
4243,spam,Show colours! Euro  -- Offer! Get England Flag & Lions tone phone! Click the following service message for info!
4248,spam,Text PASS collect your polyphonic ringtones. Normal gprs charges apply only. Enjoy your tones
4249,spam,"accordingly repeat, just text the word your mobile phone and send"
4256,spam,Block Breaker now comes deluxe format with new features and great graphics from-Mobile. Buy for just replying GET BBDELUXE and take the challenge
4258,spam,important information  orange user . today your lucky day!find out why log onto http://www.urawinner.com THERE FANTASTIC SURPRISE AWAITING YOU!
4272,spam,Natalja inviting you her friend. Reply YES- See her: www.SMS/nat STOP? Send STOP FRND 
4280,spam,"URGENT. Important information for  user. Today your lucky day!  find out why , log onto http://www.urawinner.com there fantastic surprise awaiting you !"
4281,spam,WINNER valued network customer you have been selected receivea £ prize reward claim call . Claim code. Valid  hours only.
4295,spam,Kit Strip - you have been billed. Netcollex Ltd Box OJA
4296,spam,HMV BONUS SPECIAL  pounds genuine HMV vouchers won. Just answer  easy questions. Play Now! Send HMV  More info:www.percent-real.com
4297,spam,Please CALL  immediately there urgent message waiting for you
4298,spam,thesmszone.com lets you send free anonymous and masked messages sending this message from there you see the potential for abuse???
4299,spam,"WELL DONE! Your * Costa Del Sol Holiday £ await collection. Call  Now toClaim. SAE, TCs, POBox, Stockport, SKxh, Cost, Maxmins"
4311,spam,Someone know has asked our dating service  contact you! Cant Guess who? CALL  NOW all will revealed BOX
4329,spam,"Congrats!  mobile Videophones yours. call  now! videochat wid mates, play java games, Dload polyH music, noline rentl"
4348,spam,  have secret admirer who looking  make contact with-find out who they*reveal who thinks special-call 
4355,spam,important information  orange user xxxxxxx. today your lucky day!find out why log onto http://www.urawinner.com THERE FANTASTIC SURPRISE AWAITING YOU!
4359,spam,Our dating service has been asked  contact someone shy! CALL  NOW all will revealed. POBox
4371,spam, you want new Video handset?  any time any network mins? UNLIMITED TEXT? Camcorder? Reply Call now  for del Sat
4373,spam," balance now £. Next question: Complete the landmark, Big. Bob. Barry. Ben ?. Text . Good luck!"
4376,spam, TONEXS subscription has been renewed and you have been charged £.. You can choose  more polys this month. www.clubzed *BILLING MSG*
4377,spam," you don, your prize will another customer www.biz/min Polo Ltd Suite  London Please call back busy"
4386,spam, you want New Nokia Colour Phone Delivered Tomorrow? With  FREE minutes any mobile +  FREE text + FREE camcorder Reply Call 
4394,spam,RECPT /. You have ordered Ringtone. Your order being processed...
4407,spam, one our registered subscribers can enter the draw. gift voucher replying with ENTER unsubscribe text STOP
4410,spam,"For your chance WIN FREE Bluetooth Headset then simply reply back with ""ADP"""
4436,spam,Don floppy snappy & happy! Only gay chat service with photo upload call/min).  stop our texts call 
4450,spam,"Urgent awarded complimentary trip EuroDisinc Trav, Aco&Entry claim txt DIS  +*£.(moreFrmMob. ShrAcomOrSglSuplt"
4460,spam,Welcome-mobile-date this msg FREE giving you free calling . Future mgs billed daily cancel send stop 
4473,spam,. You have received your mobile content. Enjoy
4475,spam,Want explicit SEX  secs? Ring  now! Costs/min
4499,spam,"Latest Nokia Mobile iPOD Player +£ proze GUARANTEED! Reply with: WIN  now! Norcorp Ltd.£,/Mtmsgrcvd+"
4500,spam,"SMS SERVICES. for your inclusive text credits, pls goto www.comuk.net login= qxj unsubscribe with STOP extra charge. help .COMUK"
4506,spam,Mobile Club: Choose any the top quality items for your mobile. cfcaa
4514,spam,Money have won wining number  wot next
4517,spam,"Congrats!  mobile Videophones yours. call  now! videochat wid mates, play java games, Dload polyH music, noline rentl"
4527,spam," want some cock hubby away need real man  satisfy. Txt WIFE  for strings action. (Txt STOP  end, txt rec. OTBox. )"
4534,spam, new service - live sex video chat your mob - see the sexiest dirtiest girls live phone -  details text horny cancel send STOP 
4543,spam,FreeMsg baby wow just got new cam moby. Wanna hot pic Fancy chat win uTxt / rply CHAT  Hlp  Msgp rcv
4571,spam,Wanna have laugh? Try CHIT-CHAT your mobile now! Logon txting the word: CHAT and send Box  London/msg rcvd
4574,spam,URGENT! This the attempt contact have WON £CALL&csBCMWCNXX.callcostppmmobilesvary. max£. 
4577,spam,Congratulations awarded vouchers gift guaranteed & Free entry   wkly draw txt MUSIC 
4578,spam,"Had your contract mobile  Mnths? Latest Motorola, Nokia etc. all FREE! Double Mins & Text Orange tariffs. TEXT YES for callback remove from records"
4579,spam,"Urgent! call  from your landline. Your complimentary * Ibiza Holiday , cash await collection SAE BOX  ppm +"
4584,spam,For chance win £ wkly shopping spree TXT: SHOP www.txt--shop.com custcare
4586,spam, have Secret Admirer who looking  make contact with-find out who they*reveal who thinks special-call -stopsms-ppm
4587,spam,"Mila, age, blonde, new look sex with guys like fun with. Text MTALK/txt free. £. increments. Help"
4592,spam,Well done ENGLAND! Get the official poly ringtone colour flag yer mobile! text TONE FLAG  NOW! Opt-out txt ENG STOP. Box WWX £.
4602,spam,FreeMsg: Txt: CALL:  & claim your reward  hours talk time use from your phone now! SubscribeGBP/mnth inc hrs  stop?txtStop
4616,spam,Sunshine Quiz! Win super Sony DVD recorder you canname the capital Australia? Text MQUIZ
4628,spam,Please call our customer service representative    between you have WON guaranteed £ cash £ prize!
4629,spam,Todays Voda numbers ending with  are selected receive £ reward you have match please call  quoting claim code  standard rates apply.
4643,spam,You are being ripped off! Get your mobile content from www.clubmoby.com call  poly/true/Pix/Ringtones/Games six downloads for only 
4647,spam, tried contact you your reply our offer Video Phone  anytime any network mins Half Price Line Rental Camcorder Reply call 
4652,spam, £ XMAS REWARD WAITING FOR YOU! Our computer has randomly picked you from our loyal mobile customers receive £ reward. Just call  
4658,spam,PRIVATE! Your  Account Statement for shows-redeemed. points. Call  Identifier Code:  Expires //
4673,spam,"Customer service announcement recently tried make delivery you but were unable, please call-schedule. Ref:"
4676,spam," babe its Chloe, how was smashed saturday night was great! How was your weekend been missing visionsms.com Text stop stop/text"
4696,spam,"URGENT! Your Mobile  was awarded £, Bonus Caller Prize //! This our attempt contact YOU! Call -- BOXQU"
4701,spam,WIN have winner. Foley won iPod! More exciting prizes soon keep eye mobile visit www.win
4725,spam,"FREE GAME. Get Rayman Golf  FREE from the Games Arcade get games settings. Reply POST, then save & activ. Press  key for Arcade. Termsapply"
4728,spam,"Had your mobile  mths? Update the latest Camera/Video phones for FREE. KEEP SAME NUMBER, Get extra free mins/texts. Text YES for call"
4735,spam,Buy Space Invaders chance  win orig Arcade Game console. Press  for Games Arcade (std WAP charge) See/games  Terms + settings purchase
4746,spam,Camera - You are awarded SiPix Digital Camera! call  fromm landline. Delivery within  days.
4752,spam,Your weekly Cool-Mob tones are ready download !This weeks new Tones include: ) Crazy Frog-AXEL>>> ) Akon-Lonely>>> ) Black Eyed-Dont >>>More info
4754,spam,Cashbin (Get lots cash this weekend!) www.cashbin Dear Welcome the weekend have got our biggest and best EVER cash give away!! These..
4759,spam,URGENT! Your Mobile number has been awarded with £ prize GUARANTEED. Call  from land line. Claim . Valid hrs only ppm
4760,spam,Thanks  your continued support Your question this week will enter our draw  £ cash. Name the NEW President? txt ans 
4768,spam,Your unique user . For removal send STOP  customer services 
4786,spam,"Urgent -call from Landline. Your complimentary * Ibiza Holiday £, cash await collection SAE BOX ppm +"
4797,spam,URGENT This our attempt contact. Your £ prize from YESTERDAY still awaiting collection claim CALL NOW 
4798,spam,Santa calling! Would your little ones like call from Santa Xmas Eve? Call book you time. Calls.ppm last mins www.santacalling.com
4808,spam,PRIVATE! Your  Account Statement for **** shows  unredeemed Bonus Points claim call  Identifier Code:  Expires ..
4821,spam,Check Out Choose Your Babe Videos @ sms.shsex.netUN fgkslpoPW fgkslpo
4823,spam, winner ave been specially selected  receive £ cash * holiday (flights inc) speak live operator  claim/min ( )
4834,spam,"New Mobiles from , MUST! Txt: NOKIA:  & collect yours today! From ONLY £. www.biz optout .gbp/mtmsg TXTAUCTION."
4841,spam,PRIVATE! Your  Account Statement for shows-redeemed. points. Call  Identifier Code:  Expires //
4845,spam,YOU HAVE WON valued Vodafone customer our computer has picked YOU win £ prize collect easy. Just call  
4863,spam,**FREE MESSAGE**Thanks for using the Auction Subscription Service/MSGRCVD  Skip Auction txt OUT.  Unsubscribe txt STOP CustomerCare 
4864,spam,Bored housewives! Chat date now-national rate/min only from landlines!
4877,spam,lyricalladie inviting you her friend. Reply YES-. See her: www.SMS/hmmross STOP? Send STOP FRND 
4879,spam,  POLYPHONIC tone mob every week! Just txt Tone FREE get txtin now and tell friends/tone.  reply info
4888,spam,Todays Vodafone numbers ending with  are selected receive £ award your number matches call receive your £ award.
